{
  "$schema": "https://alloy.chat/schemas/v1/theme.json",
  "schema_version": 1,
  "id": "alloy-dark",
  "name": "Alloy Dark",
  "author": "Alloy Team",
  "version": "0.1.0",
  "mode": "dark",
  "tokens": {
    "color": {
      "surface": {
        "canvas": "#18181b",
        "subtle": "#27272a",
        "panel": "#1f1f23",
        "elevated": "#27272a",
        "hover": "#3f3f46"
      },
      "background": "#18181b",
      "text": {
        "primary": "#f4f4f5",
        "secondary": "#a1a1aa",
        "muted": "#71717a",
        "link": "#60a5fa",
        "on_accent": "#ffffff"
      },
      "accent": {
        "primary": "#5865f2",
        "secondary": "#818cf8",
        "subtle": "#312e81",
        "hover": "#4f46e5"
      },
      "status": {
        "online": "#22c55e",
        "away": "#f59e0b",
        "busy": "#ef4444",
        "offline": "#71717a",
        "error": "#ef4444",
        "warning": "#f59e0b",
        "info": "#3b82f6",
        "success": "#22c55e",
        "mention": "#f97316"
      },
      "bubble": {
        "own": {
          "background": "#4f46e5",
          "text": "#ffffff"
        },
        "other": {
          "background": "#27272a",
          "text": "#f4f4f5"
        }
      },
      "border": {
        "subtle": "#27272a",
        "prominent": "#3f3f46"
      }
    },
    "typography": {
      "font_family": {
        "sans": "Inter, -apple-system, BlinkMacSystemFont, 'Segoe UI', Roboto, sans-serif",
        "mono": "'JetBrains Mono', 'Fira Code', monospace",
        "display": "Inter, -apple-system, BlinkMacSystemFont, sans-serif"
      },
      "size": {
        "xs": "11px",
        "sm": "12px",
        "base": "14px",
        "lg": "16px",
        "xl": "18px",
        "xxl": "24px"
      },
      "weight": {
        "regular": "400",
        "medium": "500",
        "semibold": "600",
        "bold": "700"
      },
      "line_height": {
        "tight": "1.25",
        "normal": "1.5",
        "relaxed": "1.75"
      }
    },
    "spacing": {
      "density": "normal",
      "presets": {
        "compact": {
          "message_padding": "4px",
          "avatar_size": "28px",
          "item_gap": "4px"
        },
        "normal": {
          "message_padding": "8px",
          "avatar_size": "36px",
          "item_gap": "8px"
        },
        "cozy": {
          "message_padding": "12px",
          "avatar_size": "40px",
          "item_gap": "12px"
        }
      },
      "scale": {
        "1": "4px",
        "2": "8px",
        "3": "12px",
        "4": "16px",
        "6": "24px",
        "8": "32px"
      },
      "message_padding": "8px",
      "avatar_size": "36px"
    },
    "radii": {
      "none": "0px",
      "sm": "4px",
      "md": "8px",
      "lg": "12px",
      "full": "9999px"
    },
    "elevation": {
      "none": "none",
      "sm": "0 1px 2px 0 rgba(0, 0, 0, 0.4)",
      "md": "0 4px 6px -1px rgba(0, 0, 0, 0.5), 0 2px 4px -2px rgba(0, 0, 0, 0.5)",
      "lg": "0 10px 15px -3px rgba(0, 0, 0, 0.6), 0 4px 6px -4px rgba(0, 0, 0, 0.6)"
    },
    "motion": {
      "duration": {
        "fast": "100ms",
        "normal": "200ms",
        "slow": "350ms"
      },
      "easing": {
        "ease": "ease",
        "ease_in_out": "cubic-bezier(0.4, 0, 0.2, 1)"
      },
      "reduced_motion": false
    },
    "layout": {
      "message_style": "bubble",
      "avatar_shape": "circle"
    }
  }
}
